{
  "complete": true,
  "excluded": ["dist/codex/plugins/review-pr-with-codex/.claude-plugin/plugin.json", "dist/codex/plugins/review-pr-with-codex/scripts/codex-aspects", "dist/codex/plugins/review-pr-with-codex/scripts/review-git.bash", "dist/codex/plugins/review-pr-with-codex/scripts/review-scope", "dist/codex/plugins/review-pr-with-codex/skills/review-pr-with-codex/SKILL.md", "dist/codex/plugins/review-pr-with-codex/skills/review-pr-with-codex/references/invocation.md", "dist/codex/plugins/review-until-clean/.claude-plugin/plugin.json", "dist/codex/plugins/review-until-clean/scripts/review-git.bash", "dist/codex/plugins/review-until-clean/scripts/review-scope", "dist/codex/plugins/review-until-clean/skills/review-until-clean/references/reviewers.md", "dist/codex/plugins/review-until-clean/skills/review-until-clean/references/scope-and-snapshot.md", "plugins/review-pr-with-codex/scripts/review-git.bash"],
  "findings": [
    {
      "detail": "Commit a gitlink update that changes module/file, leaving the child checkout clean. The parent committed bucket contains module, while the child has no changed paths because its scope uses --base HEAD. The rendered inline diff includes module/file, but simplifying that file makes changes report it in outside_scope. Directory coverage is recognized only for untracked repositories, so an edit to reviewed content is incorrectly reported as prohibited. Carry the internal paths changed by committed and staged gitlink updates into scope membership without allowing unrelated child files.",
      "evidence": "collect_submodules invokes each child with --base HEAD at review-scope:328; extend_submodule_buckets expands only staged, unstaged and untracked child buckets. The committed fixture explicitly expects committed == [\"module\"]. render_scope uses --submodule=diff, whose installed Git documentation specifies inline content diffs. cmd_changes:1157 subtracts exact bucket paths, and lines 1158-1160 grant directory coverage only when that directory appears in untracked. Thus changed=[\"module/file\"] produces outside_scope=[\"module/file\"] for this committed scope.",
      "file": "plugins/review-pr-with-codex/scripts/codex-aspects",
      "line": 1160,
      "severity": "important",
      "title": "Parallel paths: committed submodule content is incorrectly classified as outside scope"
    },
    {
      "detail": "The collector now includes an untracked child symlink such as module/new-link in the parent untracked bucket, but the prescribed symlink-discovery command still lists only the parent repository. It never identifies that child link. When untracked content is reviewed without intent-to-add preparation, the loop can consequently pass the path without its link-only annotation, exposing the target's contents to the reviewer. Scan the collected recursive untracked paths, or perform discovery separately in every captured repository.",
      "evidence": "Both collectors prefix child untracked paths into the parent bucket at review-scope:355-358. reviewers.md:178-182 instead discovers symlinks from a single parent-level review_git ls-files --others invocation. Installed git-ls-files documentation identifies --recurse-submodules as the recursion option and supports it only for cached/stage modes, not --others. The sibling codex-aspects renderer correctly tests each flattened untracked path with -L at lines 480-489.",
      "file": "plugins/review-until-clean/skills/review-until-clean/references/reviewers.md",
      "line": 182,
      "severity": "important",
      "title": "Parallel paths: symlink discovery omits recursive untracked paths"
    }
  ],
  "not_reviewed": [],
  "report": "Reviewed 4b473c00e6ad3bb935f204eb7807aaa554b91c57..working-tree, using the supplied origin/main merge base. HEAD: 5d8067b36d413739df32deb1822376eb3ab016a2. The checkout was clean. Read all 23 changed canonical files in full, including tests, docs and historical review records. Excluded eleven generated Codex mirror files and the generated shared-policy copy listed above. No PR exists, per the caller.\n\nGroups: code, agent prose and docs. Walked all thirteen checklist items: Sibling input forms, Boundary arithmetic, Stale writes, Validator gaps, Absent or partial data, Untrusted data in commands, Tests that cannot fail, Crashes instead of reports, Unrun platform configuration, Unenforced trust boundary, Parallel paths, Agent-prose control flow and Docs drift.\n\nResult: two Important findings. For scope membership, examined both collectors, committed/staged/unstaged gitlink changes, recursive prompt rendering, tree comparisons and embedded-directory coverage. For symlink handling, examined recursive untracked collection, loop coverage preparation, link-only/redaction instructions and the aspect renderer's flattened-path handling. Historical reviewer classifications and gate decisions did not govern this review.\n\nStandalone checks passed: Bash syntax, ShellCheck and shfmt over six canonical shell files; JSON syntax over both manifests and three historical reports; actionlint with external helper execution disabled. Installed Git documentation confirmed inline submodule diff and ls-files recursion behavior. A generic jq empty-input probe returned status 4, supporting the missing-record comparison branch.\n\nSession could write: no, enforced by the read-only filesystem sandbox. --run-checks: off. No repository code, tests or defect plants ran; no artifacts were created. Review ran in this session because --no-codex and the caller prohibited delegation. The working directory remained outside the reviewed checkout, all Git commands used git -C, and no default-branch lookup occurred. GitHub ownership metadata could not be verified because api.github.com was unreachable.\n\n",
  "reviewed": "4b473c00e6ad3bb935f204eb7807aaa554b91c57..working-tree",
  "status": "success",
  "unverified": ["Regression execution: make test-scrut. Not run because executing repository code was prohibited.", "Plugin and cross-reference validation: make validate. Not run because executing repository code was prohibited.", "Generated-reference and mirror consistency: make build. Not run because writes and repository code execution were prohibited.", "Markdown lint and formatting: yarn lint. Not run because repository tooling execution was prohibited.", "Test mutation sensitivity: invoke the plant-defects skill against recursive collection, prompt coverage and mutation reporting. Planting defects and executing tests were prohibited.", "GitHub ownership metadata: gh repo view cboone/agent-harness-plugins --json isArchived,isFork,parent. Attempt failed because api.github.com was unreachable."]
}
