{
  "complete": true,
  "excluded": ["dist/codex/plugins/review-pr-with-codex/.claude-plugin/plugin.json", "dist/codex/plugins/review-pr-with-codex/scripts/codex-aspects", "dist/codex/plugins/review-pr-with-codex/scripts/review-git.bash", "dist/codex/plugins/review-pr-with-codex/scripts/review-scope", "dist/codex/plugins/review-pr-with-codex/skills/review-pr-with-codex/SKILL.md", "dist/codex/plugins/review-pr-with-codex/skills/review-pr-with-codex/references/invocation.md", "dist/codex/plugins/review-until-clean/.claude-plugin/plugin.json", "dist/codex/plugins/review-until-clean/scripts/review-git.bash", "dist/codex/plugins/review-until-clean/scripts/review-scope", "dist/codex/plugins/review-until-clean/skills/review-until-clean/references/reviewers.md", "dist/codex/plugins/review-until-clean/skills/review-until-clean/references/scope-and-snapshot.md", "plugins/review-pr-with-codex/scripts/review-git.bash"],
  "findings": [
    {
      "detail": "An initialized submodule with a reviewed path such as module/src/file.go can have mandatory review instructions in its historical AGENTS.md. Guideline discovery queries module/AGENTS.md using the superproject's revision and object database. That tree contains a gitlink, not the child's files, so the guide is omitted. The rendered prompt also prohibits loading checkout instruction files, leaving the child's required review checks unapplied while the aspect can report success. Resolve historical guidance within each captured repository using the corresponding trusted child revision. The root-only lookup predates this change; recursive child review exposes the mismatch.",
      "evidence": "render_scope recursively visits initialized child scopes at codex-aspects:447-454. In contrast, render_guides selects only the outer .base // .head at line 567 and passes that ref and the outer top_level to every historical_guide call at line 579. historical_guide queries that repository with ls-tree at line 539. No child-repository or child-revision resolution occurs. Lines 674-676 instruct reviewers to use the supplied historical guidance and avoid current checkout instructions.",
      "file": "plugins/review-pr-with-codex/scripts/codex-aspects",
      "line": 579,
      "severity": "important",
      "title": "Parallel paths: recursive reviews omit historical submodule instructions"
    }
  ],
  "not_reviewed": [],
  "report": "Reviewed 4b473c00e6ad3bb935f204eb7807aaa554b91c57..working-tree against the supplied origin/main merge base. Read all 34 changed canonical files in full, including tests, documentation and historical review records. The two review-scope copies were confirmed byte-identical. Excluded the eleven generated Codex mirrors and generated shared-policy copy listed in excluded. HEAD was 1c8e28614d920fc0cf75ca07ac1c44ed9e9f60ce; the checkout was clean. No PR exists, per the caller. No default-branch lookup occurred.\n\nGroups: code, agent prose and docs. Walked all thirteen items: Sibling input forms, Boundary arithmetic, Stale writes, Validator gaps, Absent or partial data, Untrusted data in commands, Tests that cannot fail, Crashes instead of reports, Unrun platform configuration, Unenforced trust boundary, Parallel paths, Agent-prose control flow and Docs drift.\n\nResult: one Important finding. Siblings examined included recursive scope and diff rendering, historical guide lookup, guide precedence and symlink resolution, checkout-instruction restrictions, and historical-guidance tests. Child review traversal recurses, but trusted-guideline discovery remains bound to the superproject. Historical reviewer classifications and ledger gates did not govern this review.\n\nMechanical checks: Bash 3.2 syntax, shfmt, JSON syntax and actionlint passed. Actionlint external helpers were disabled. Standalone ShellCheck with --norc returned informational SC2016 for the quoted jq definitions in review-git.bash:29; no Important finding was emitted for that diagnostic. Runtime tests, repository validators and defect plants remain unverified as listed.\n\nSession could write: no, enforced by the filesystem sandbox. --run-checks: off. No writes, delegation or repository code execution occurred; checks created no artifacts. --no-codex and the delegation prohibition selected this session. The existing working directory remained outside the reviewed repository, with Git operations using hardened git -C commands. GitHub ownership metadata lookup failed because api.github.com was unreachable.\n\nThis round is not clean at Important. Continuation gates belong to the caller.",
  "reviewed": "4b473c00e6ad3bb935f204eb7807aaa554b91c57..working-tree",
  "status": "success",
  "unverified": ["Regression execution: make test-scrut from the reviewed repository root. Repository code execution was prohibited.", "Plugin, cross-reference and shared-copy validation: make validate. Repository code execution was prohibited.", "Markdown validation: yarn lint. Package-script execution was prohibited.", "Test mutation sensitivity: invoke the installed plant-defects skill, then make test-scrut. Writes and repository code execution were prohibited.", "GitHub ownership metadata: gh repo view cboone/agent-harness-plugins --json isArchived,isFork,parent. The attempt failed because api.github.com was unreachable."]
}
