{
  "complete": true,
  "excluded": ["dist/codex/plugins/review-pr-with-codex/.claude-plugin/plugin.json", "dist/codex/plugins/review-pr-with-codex/scripts/codex-aspects", "dist/codex/plugins/review-pr-with-codex/scripts/review-git.bash", "dist/codex/plugins/review-pr-with-codex/scripts/review-scope", "dist/codex/plugins/review-pr-with-codex/skills/review-pr-with-codex/SKILL.md", "dist/codex/plugins/review-pr-with-codex/skills/review-pr-with-codex/references/invocation.md", "dist/codex/plugins/review-until-clean/.claude-plugin/plugin.json", "dist/codex/plugins/review-until-clean/scripts/review-git.bash", "dist/codex/plugins/review-until-clean/scripts/review-scope", "dist/codex/plugins/review-until-clean/skills/review-until-clean/references/reviewers.md", "dist/codex/plugins/review-until-clean/skills/review-until-clean/references/scope-and-snapshot.md", "plugins/review-pr-with-codex/scripts/review-git.bash"],
  "findings": [
    {
      "detail": "An initialized submodule with a reviewed path such as module/src/file.go can require additional checks in its historical AGENTS.md. Guide discovery looks for module/AGENTS.md in the superproject's revision and object database, whose tree contains only the gitlink. The child's instructions are therefore omitted. The prompt also prohibits using checkout instruction files, so an aspect can report successful review without applying those required checks. Resolve child guidance in the child's object database at the revision selected by the trusted parent baseline, recursively. The root-only lookup predates this change; recursive child review exposes the mismatch.",
      "evidence": "render_scope recursively visits initialized child scopes at codex-aspects:447-454. render_guides instead selects only the outer .base // .head at line 567 and passes that ref and outer top_level to every historical_guide call at line 579. historical_guide runs ls-tree against that repository at line 539. No child repository or historical child revision is resolved. Lines 674-676 require the supplied historical guidelines and reject current checkout instructions.",
      "file": "plugins/review-pr-with-codex/scripts/codex-aspects",
      "line": 579,
      "severity": "important",
      "title": "Parallel paths: recursive reviews omit historical submodule instructions"
    }
  ],
  "not_reviewed": [],
  "report": "Reviewed 4b473c00e6ad3bb935f204eb7807aaa554b91c57..working-tree against the supplied origin/main merge base. Read all 37 changed canonical files in full, including tests, docs and historical review records. Confirmed the two review-scope copies are byte-identical. Excluded eleven generated Codex mirrors and one generated shared-policy copy, individually listed in excluded. HEAD remained f232611b317fcfef8f36f4d9b4cf2a6a17516a59; the checkout remained clean. Existing ignored .yarn/ and node_modules/ entries were unchanged. No PR exists, per the caller. No default-branch lookup occurred.\n\nGroups: code, agent prose and docs. Walked all thirteen items: Sibling input forms, Boundary arithmetic, Stale writes, Validator gaps, Absent or partial data, Untrusted data in commands, Tests that cannot fail, Crashes instead of reports, Unrun platform configuration, Unenforced trust boundary, Parallel paths, Agent-prose control flow and Docs drift.\n\nResult: one Important finding. Siblings examined included recursive scope and diff rendering, historical guide lookup, guide precedence and symlink resolution, checkout-instruction restrictions, and root/nested historical-guidance tests. Recursive file review is supported, but trusted guide discovery remains bound to the superproject. Historical reviewer output and ledger gates did not determine classification or continuation.\n\nStandalone checks: Bash syntax passed for six canonical shell files; shfmt, JSON syntax for both manifests and thirteen historical reports, and actionlint passed. Actionlint external helpers were disabled. ShellCheck with --norc returned exit 1 for informational SC2016 on the deliberately single-quoted jq definitions at review-git.bash:29; this was not classified as Important. Runtime tests, repository validators and defect plants remain unverified as listed.\n\nSession could write: no, enforced by the filesystem sandbox. --run-checks: off. No writes, delegation or repository code execution occurred. Checks left no artifacts. --no-codex and the delegation prohibition selected this session. The existing working directory remained outside the reviewed repository; Git operations used hardened git -C commands.\n\nNot clean at Important. Continuation gates belong to the caller.",
  "reviewed": "4b473c00e6ad3bb935f204eb7807aaa554b91c57..working-tree",
  "status": "success",
  "unverified": ["Regression execution: make test-scrut from the reviewed repository root. Repository code execution was prohibited.", "Plugin, cross-reference and shared-copy validation: make validate. Repository code execution was prohibited.", "Markdown validation: yarn lint. Package-script execution was prohibited.", "Test mutation sensitivity: invoke the installed plant-defects skill, then make test-scrut. Writes and execution were prohibited.", "Ownership/archive metadata: gh repo view cboone/agent-harness-plugins --json isArchived,isFork,parent. API unreachable."]
}
