{
  "complete": true,
  "excluded": ["dist/codex/plugins/review-pr-with-codex/.claude-plugin/plugin.json", "dist/codex/plugins/review-pr-with-codex/scripts/codex-aspects", "dist/codex/plugins/review-pr-with-codex/scripts/review-git.bash", "dist/codex/plugins/review-pr-with-codex/scripts/review-scope", "dist/codex/plugins/review-pr-with-codex/skills/review-pr-with-codex/SKILL.md", "dist/codex/plugins/review-pr-with-codex/skills/review-pr-with-codex/references/invocation.md", "dist/codex/plugins/review-until-clean/.claude-plugin/plugin.json", "dist/codex/plugins/review-until-clean/scripts/review-git.bash", "dist/codex/plugins/review-until-clean/scripts/review-scope", "dist/codex/plugins/review-until-clean/skills/review-until-clean/references/reviewers.md", "dist/codex/plugins/review-until-clean/skills/review-until-clean/references/scope-and-snapshot.md", "plugins/review-pr-with-codex/scripts/review-git.bash"],
  "findings": [
    {
      "detail": "For a reviewed child path such as module/src/file.go, historical guide discovery searches for module/AGENTS.md in the superproject's baseline tree. That tree contains a gitlink and cannot supply the child's guide. The prompt then prohibits loading checkout instructions, so review can report success without applying mandatory child checks. The root-only lookup predates this change; the new recursive review exposes the mismatch. Resolve historical child guidance using the child's object database and the revision pinned by the trusted parent baseline, recursively.",
      "evidence": "render_scope recursively visits initialized child scopes at codex-aspects:447-454. render_guides selects only the outer .base // .head at line 568 and passes that revision and outer top_level to historical_guide at line 580. historical_guide queries that repository with ls-tree at line 540 and treats an empty result as absence. No child repository/revision resolution occurs. The prompt requires the supplied historical guidelines and rejects current checkout instructions.",
      "file": "plugins/review-pr-with-codex/scripts/codex-aspects",
      "line": 580,
      "severity": "important",
      "title": "Parallel paths: recursive review omits historical child guidance"
    }
  ],
  "not_reviewed": [],
  "report": "Reviewed a2e56c535ed6326cc8d531d945fbb6c627a9b335..HEAD in the specified repository. HEAD remained f978e22c5e8fc330ea6bd6582ab5ce23593e26b8, with a clean working tree. Read all 65 changed canonical files fully, including tests, docs and historical process records. The two canonical review-scope copies were confirmed byte-identical. Excluded the eleven generated Codex mirrors and generated shared-policy copy listed in excluded. Read the supplied body for https://github.com/cboone/agent-harness-plugins/pull/675 without querying remote services.\n\nGroups: code, agent prose and docs. Walked all thirteen items: Sibling input forms, Boundary arithmetic, Stale writes, Validator gaps, Absent or partial data, Untrusted data in commands, Tests that cannot fail, Crashes instead of reports, Unrun platform configuration, Unenforced trust boundary, Parallel paths, Agent-prose control flow and Docs drift.\n\nOne Important finding remains. Siblings examined included recursive scope collection, exact committed/staged/unstaged gitlink membership, prompt rendering, historical guide precedence and symlink resolution, checkout-instruction restrictions, invocation documentation, and historical-guidance tests. The supplied PR body discloses the guidance follow-up. Historical classifications and continuation instructions did not govern this review. Critical-only adjudication belongs to the caller; this is not clean at Important.\n\nStandalone checks: Bash syntax and shfmt passed for all eight changed canonical shell files. JSON syntax passed. ShellCheck --norc exited 1 with informational SC1091 source-following diagnostics and SC2016 on deliberately quoted jq definitions; it is not reported as a pass. Repository tests, validators and defect plants were not executed.\n\nSession could write: no, enforced by the read-only filesystem sandbox. --run-checks: off. No delegation, writes, repository code execution or remote queries occurred. Checks left no artifacts. --no-codex and the explicit delegation prohibition selected this session. The existing working directory stayed outside the reviewed repository; Git commands used git -C.",
  "reviewed": "a2e56c535ed6326cc8d531d945fbb6c627a9b335..HEAD",
  "status": "success",
  "unverified": ["Runtime regression execution: make test-scrut. Not run because repository code execution was prohibited.", "Project lint and validation: make lint and make validate. Not run because repository code execution was prohibited.", "Generated-copy consistency: make build followed by git diff --exit-code. Not run because writes and repository code execution were prohibited.", "Test mutation sensitivity: invoke the plant-defects skill for recursive membership, stability and consumer guards, then run make test-scrut. Writes and repository code execution were prohibited.", "Ownership/archive metadata: gh repo view cboone/agent-harness-plugins --json isArchived,isFork,parent. Remote queries were prohibited; supplied PR identity was used."]
}
