{
  "complete": true,
  "excluded": ["dist/codex/plugins/review-pr-with-codex/.claude-plugin/plugin.json", "dist/codex/plugins/review-pr-with-codex/scripts/codex-aspects", "dist/codex/plugins/review-pr-with-codex/scripts/review-git.bash", "dist/codex/plugins/review-pr-with-codex/scripts/review-scope", "dist/codex/plugins/review-pr-with-codex/skills/review-pr-with-codex/SKILL.md", "dist/codex/plugins/review-pr-with-codex/skills/review-pr-with-codex/references/invocation.md", "dist/codex/plugins/review-until-clean/.claude-plugin/plugin.json", "dist/codex/plugins/review-until-clean/scripts/review-git.bash", "dist/codex/plugins/review-until-clean/scripts/review-scope", "dist/codex/plugins/review-until-clean/skills/review-until-clean/references/reviewers.md", "dist/codex/plugins/review-until-clean/skills/review-until-clean/references/scope-and-snapshot.md", "plugins/review-pr-with-codex/scripts/review-git.bash"],
  "findings": [
    {
      "detail": "Replace a tracked submodule checkout with a symlink, leaving the replacement unstaged. The real index still contains the gitlink, so collection includes this path even though the temporary disk index represents a symlink. This check then aborts the entire scope collection. A legitimate gitlink-to-symlink change cannot reach either review workflow. Distinguish a replacement symlink from an initialized checkout and review its link text without traversing it.",
      "evidence": "collect_submodules unions gitlinks from the real and temporary indexes at lines 314–318, then unconditionally rejects a symlink at line 322. Collection runs before the diff buckets are gathered. Both canonical review-scope copies contain this code and are byte-identical.",
      "file": "plugins/review-until-clean/scripts/review-scope",
      "line": 322,
      "severity": "important",
      "title": "Sibling input forms: gitlink-to-symlink replacements abort scope collection"
    },
    {
      "detail": "A submodule can have a normal configured name and a checkout path such as -vendor. Git's quoted -C argument accepts that path, but the following cd interprets it as options and fails, rejecting the initialized checkout. The recursive launch repeats that cd, and the uninitialized branch passes the same option-like path to find. Use an absolute child path consistently across these operations.",
      "evidence": "Lines 326 and 328 pass the repository-relative path directly to cd; line 335 does so for find. A standalone platform probe, /bin/bash -c 'builtin cd \"-review-sample\"', returned status 1 with 'cd: -r: invalid option', confirming that quoting does not prevent option parsing. Both canonical collectors share these call sites.",
      "file": "plugins/review-until-clean/scripts/review-scope",
      "line": 326,
      "severity": "important",
      "title": "Untrusted data in commands: option-like submodule paths reach cd and find"
    }
  ],
  "not_reviewed": [],
  "report": "Reviewed 4b473c00e6ad3bb935f204eb7807aaa554b91c57..working-tree against the supplied origin/main merge base. Read all 29 changed canonical files in full, including tests, docs and historical review records. Excluded the eleven generated Codex mirrors and generated shared-policy copy listed in excluded. HEAD remained a1b71d6f49d720bf0e842f87cc0cbe6ead0e80f5; the checkout remained clean. No PR exists, per the caller.\n\nGroups: code, agent prose and docs. Walked all thirteen items: Sibling input forms, Boundary arithmetic, Stale writes, Validator gaps, Absent or partial data, Untrusted data in commands, Tests that cannot fail, Crashes instead of reports, Unrun platform configuration, Unenforced trust boundary, Parallel paths, Agent-prose control flow and Docs drift.\n\nResult: two Important findings. For replacement handling, examined both collectors, real/disk index membership, gitlink transitions, symlink inventory and prompt annotation. For option-like paths, examined initialized checkout validation, recursive launch, uninitialized checkout inspection and absolute-path consumer commands. Existing fixtures use ordinary module paths and cover untracked symlinks rather than gitlink-to-symlink replacements. Historical reviewer classifications and stop instructions did not govern this review.\n\nRead-only checks passed: Bash syntax, ShellCheck and shfmt for six canonical shell files; JSON syntax for both manifests and seven historical reports; actionlint with external helpers disabled. The standalone Bash probe confirmed option parsing. Repository tests, validators and mutation checks were not executed.\n\nSession could write: no, enforced by the filesystem sandbox. --run-checks: off. No delegation, repository code execution or writes occurred. --no-codex and the caller's delegation prohibition selected this session. The working directory remained outside the reviewed repository; Git operations used git -C. No default-branch lookup occurred. GitHub ownership metadata verification was blocked by network access. No clean threshold is claimed; continuation gates belong to the caller.\n\n",
  "reviewed": "4b473c00e6ad3bb935f204eb7807aaa554b91c57..working-tree",
  "status": "success",
  "unverified": ["Regression execution: make test-scrut. Not run because repository code execution was prohibited.", "Plugin, cross-reference and shared-copy validation: make validate. Not run because repository code execution was prohibited.", "Markdown validation: yarn lint. Not run because package-script execution was prohibited.", "Test mutation sensitivity: use the installed plant-defects skill followed by make test-scrut. Writes and repository code execution were prohibited.", "GitHub ownership metadata: gh repo view cboone/agent-harness-plugins --json isArchived,isFork,parent. Attempt failed because api.github.com was unreachable."]
}
