{
  "complete": true,
  "excluded": ["dist/codex/plugins/review-pr-with-codex/.claude-plugin/plugin.json", "dist/codex/plugins/review-pr-with-codex/scripts/codex-aspects", "dist/codex/plugins/review-pr-with-codex/scripts/review-scope", "dist/codex/plugins/review-pr-with-codex/skills/review-pr-with-codex/SKILL.md", "dist/codex/plugins/review-pr-with-codex/skills/review-pr-with-codex/references/invocation.md", "dist/codex/plugins/review-until-clean/.claude-plugin/plugin.json", "dist/codex/plugins/review-until-clean/scripts/review-scope", "dist/codex/plugins/review-until-clean/skills/review-until-clean/references/reviewers.md", "dist/codex/plugins/review-until-clean/skills/review-until-clean/references/scope-and-snapshot.md"],
  "findings": [],
  "not_reviewed": [],
  "report": "Scope: 7a6997e7414d590b61f14ee8b9e9fc06cb7f5f71..HEAD, ending at f4f43a649f7e784508daf4e26fae0caec7f3ce83. Read all 22 non-generated changed files in full, including complete changed production and test files, historical review results and decision records. Examined shared inventory, membership, symlink and recursive comparison consumers. The nine excluded paths are generated dist/codex mirrors. Working tree remained clean and HEAD unchanged. No PR exists according to the parent's verification; no PR body was missing. No gh or moving-default-branch lookup ran.\n\nResult: no new Important or Critical findings. Structural Important round 2 completed; the consumed Nit and Important round 1 counts remain unchanged. Applied the approved independent lstat disk-kind and owner-execute-bit contract, regular raw pseudo-link semantics, normalization compatibility and intentional staging invalidation. Historical child guidance remains the specified out-of-scope follow-up.\n\nGroups: code, agent prose and docs. Walked all thirteen anti-pattern items: Sibling input forms; Boundary arithmetic; Stale writes; Validator gaps; Absent or partial data; Untrusted data in commands; Tests that cannot fail; Crashes instead of reports; Unrun platform configuration; Unenforced trust boundary; Parallel paths; Agent-prose control flow; Docs drift. Applied the repository Bash, Scrut and Markdown review checklists and their CI exclusions.\n\nSiblings examined: both canonical collectors; regular-file, symlink and checkout-directory branches; sparse absence and materialization; both same-byte type transitions; executable-bit changes; recursive capture and stability brackets; normalized/raw comparison union; legacy and mixed-format captures; initialization-reporting failure coverage; workflow reporting instructions.\n\nMechanical checks: /bin/bash -n passed separately for both collectors, codex-aspects and review-submodule-fixture. jq empty passed for both changed manifests and all four historical JSON review artifacts. cmp confirmed collector parity. Installed BSD/GNU stat and Git documentation confirmed the relevant metadata formats, lstat behavior, sparse tags and unfiltered hashing semantics. Runtime suites, mutation sensitivity, repository lint, validation and generated-mirror checks remain unverified.\n\nExecution: this session, as requested. --no-codex and the explicit prohibition on delegation excluded other reviewer processes and agents. Session could write: no, enforced by the read-only sandbox. --run-checks: off. No repository code, tests or builds executed. No edits or mailbox messages. Checks left nothing behind.\n\nclean at Important",
  "reviewed": "7a6997e7414d590b61f14ee8b9e9fc06cb7f5f71..HEAD",
  "status": "success",
  "unverified": ["Behavioral suites: make test-scrut. Tests and repository-code execution were prohibited.", "Mutation sensitivity: use the plant-defects skill against raw hashing, disk metadata, sparse availability, stability, recursive reporting and legacy fallback, then run make test-scrut. Planting requires prohibited edits; historical plant records were read but not independently rerun.", "Repository lint: make lint. Repository-command execution was prohibited.", "Repository validation: make validate. Repository-code execution was prohibited.", "Generated mirror regeneration and drift: make build. Builds and file writes were prohibited."]
}
